author_id,text,id,lang,created_at.x,public_metrics.retweet_count,public_metrics.reply_count,public_metrics.like_count,public_metrics.quote_count,name,url,created_at.y,description,verified,username
1124522392926281730,@NatitoOdiosa @la_convergencia @gonzalowinter @gabrielboric @GaelDiputada @Alo__arellano @ConySchon @mgoyenechea @pgselles @Naty_campusano @IgnacioAchurra Desea unirse a mi iglesia?,1384714715558031367,es,2021-04-21T03:44:49.000Z,0,0,0,0,El artista formalmente conocido como Elmo,"",2019-05-04T03:53:25.000Z,"activista del caos y pastor de la iglesia Satanica de recoleta, patriota de verdad",FALSE,Eldiablo_O_Elmo
118177650,"@met_valpo @la_convergencia @gonzalowinter @gabrielboric @GaelDiputada @Alo__arellano @ConySchon @mgoyenechea @pgselles @Naty_campusano @IgnacioAchurra 8:30 es lo que he leído, tmbn 21:00 pero creo que ahi es más dificil salir a la calle. Hay lugares donde ya están caceroleando.",1384653835973627905,es,2021-04-20T23:42:54.000Z,2,0,10,0,Daniel Dem,"",2010-02-27T21:07:05.000Z,"Libertad a los presos políticos de la revuelta !
Latinoamérica Libre 🏔️🏞️

#NoAlTPP11 #FreeAssange #FreeTibet",FALSE,Daniel_Dem1
1189314515130900491,"@la_convergencia El Intendente de Lugano pregunta si estan caceroleando x el presupuesto de educación del Pro, q cada año baja xq la educación nunca les importó!!",1384661132846243842,es,2021-04-21T00:11:54.000Z,0,0,0,0,SofiANDREA.Loren❤✌🇦🇷💚🇦🇷✌✌✌✌✌✌✌✌✌✌🇦🇷💚🇦🇷✌❤,"",2019-10-29T22:54:26.000Z,"Plebeya
🇦🇷😷🇦🇷😷🇦🇷😷🇦🇷😷🇦🇷",FALSE,Sofialo15398469
1191310000486006784,@Alo__arellano @la_convergencia @elfrente_amplio ¿Van a seguir con Saludos a la bandera y levantando monos de paja para simular que algo están haciendo? Ya le salvaron el poto a Piñera el15 de nov. ya vendieron el estallido social y la Asamblea Constituyente  ¡No sigan especulando!,1384685054450814978,es,2021-04-21T01:46:57.000Z,0,0,0,0,Fabio Moraga Valle,https://t.co/3JWBmnBegH,2019-11-04T11:03:43.000Z,"Doctor en Historia, académico.",FALSE,MoragaFabio
1191428083171176448,@la_convergencia @gonzalowinter @gabrielboric @GaelDiputada @Alo__arellano @ConySchon @mgoyenechea @pgselles @Naty_campusano @IgnacioAchurra Cacerolas de esponjas jajajjaja #QuePenaTuCacerolazo,1384686738388529154,es,2021-04-21T01:53:39.000Z,0,0,0,0,marco88,"",2019-11-04T18:53:00.000Z,"Boia Chi Molla 
Anticomunista",FALSE,andreso99400391
1221395694076014592,@elfrente_amplio @RDemocratica @la_convergencia @Liberales_Chile @PCdeChile @PartidoVerdeCoL @phumanista @PSChile @PRadicalcl @PPD_Chile @PDC_Chile asi ejerzamos entre la mayoria de los trabajadores y chilenos en gral una presion a este gob. Indolente e ineficaz https://t.co/Kn6zRNw0Tz,1384729677055594497,es,2021-04-21T04:44:16.000Z,0,0,0,0,Anarco Acab,"",2020-01-26T11:33:40.000Z,"yo soy de un pensamiento mas bien anarquista,de la linea de proudom y bakunin,vegano,antiDerechistas ANTISIONISTA,ANTIJUDIO,ME DECLARO PRO PALESTINA LIBRE.",FALSE,AcabAnarco
1226928466601357312,@AHumanistaCL @diego_ibanezc @la_convergencia @RDemocratica @movimientounir @ComunesCL @phumanista @PCdeChile @Muletjaime @PPD_Chile @PRadicalcl @Liberales_Chile @PSChile @PDC_Chile @tomashirsch Excelente muchachos,1384699800780746752,es,2021-04-21T02:45:33.000Z,0,0,2,0,Alexis_sebastian,"",2020-02-10T17:58:50.000Z,En este mundo de sombra y de luz la verdad se logra ocultar pero siempre suele llegar alguien que no la deja de buscar... APRUEBO+CC,FALSE,Pipesebastian3
1226928466601357312,"@la_convergencia Menos redes sociales y más accion, aparte de Diego Ibáñez que diputado más está apoyando la acusación constitucional a Piñera",1384656419899781123,es,2021-04-20T23:53:10.000Z,2,0,2,0,Alexis_sebastian,"",2020-02-10T17:58:50.000Z,En este mundo de sombra y de luz la verdad se logra ocultar pero siempre suele llegar alguien que no la deja de buscar... APRUEBO+CC,FALSE,Pipesebastian3
1226928466601357312,@AHumanistaCL @diego_ibanezc @la_convergencia @RDemocratica @movimientounir @ComunesCL @phumanista @PCdeChile @Muletjaime @PPD_Chile @PRadicalcl @Liberales_Chile @PSChile @PDC_Chile Entonces que @tomashirsch haga el comunicado que su firma tmbn esta para acusar a Piñera,1384685195635404802,es,2021-04-21T01:47:31.000Z,0,1,0,0,Alexis_sebastian,"",2020-02-10T17:58:50.000Z,En este mundo de sombra y de luz la verdad se logra ocultar pero siempre suele llegar alguien que no la deja de buscar... APRUEBO+CC,FALSE,Pipesebastian3
1226928466601357312,"@la_convergencia @Alo__arellano @GaelDiputada @gonzalowinter @diego_ibanezc @gabrielboric @vg_matias @iamjaimefuentes @RELE_CIDH Oye una pregunta, van apoyar con su firma la acusación a Piñera si o no?",1384667007317155843,es,2021-04-21T00:35:15.000Z,0,0,0,0,Alexis_sebastian,"",2020-02-10T17:58:50.000Z,En este mundo de sombra y de luz la verdad se logra ocultar pero siempre suele llegar alguien que no la deja de buscar... APRUEBO+CC,FALSE,Pipesebastian3
126005099,@matias_astima @la_convergencia Puro show político,1384680068019105792,es,2021-04-21T01:27:08.000Z,0,0,0,0,AlejandroSmith,http://t.co/KWI4jwYitW,2010-03-24T14:56:16.000Z,Los Rt es solo a modo de difusión y no representan necesariamente el pensamiento de este Divergente,FALSE,Alejandr0Smith
1286703048,"@la_convergencia @gonzalowinter @gabrielboric @GaelDiputada @Alo__arellano @ConySchon @mgoyenechea @pgselles @Naty_campusano @IgnacioAchurra Y que dice su abanderado sobre ésto?
Esta durmiendo el ql de @gabrielboric ... que va a decir, si lo consideraba una mala política.",1384668620182237186,es,2021-04-21T00:41:39.000Z,0,0,0,0,A.J.,"",2013-03-21T19:06:04.000Z,"No vivo en chilezuela, vivo en Chile Poor State Of South América",FALSE,ByJaaQ
1318999515811127296,@GobiernodeChile @sebastianpinera @joseantoniokast @PCdeChile @PSChile @PPD_Chile @PDC_Chile @PRadicalcl @phumanista @elfrente_amplio @RDemocratica @la_convergencia @ComunesCL @alejandramatus @mirnaschindler @camila_vallejo @KarolCariola https://t.co/6hWTW3YNOw,1384750797314002944,und,2021-04-21T06:08:12.000Z,0,0,1,0,#RECHACHAZO...,"",2020-10-21T19:36:20.000Z,#Rechazo...A la derecha de la UDI...Hooyah.👍🦅🇨🇱🇨🇱🇨🇱🇨🇱🇨🇱🇨🇱🇨🇱...#PajaroComunistaMeBotasteDeNuevo,FALSE,kommander911
1318999515811127296,@LaRedTV @mentiraslared @CNTVChile @PCdeChile @PSChile @PPD_Chile @PDC_Chile @PRadicalcl @phumanista @RDemocratica @la_convergencia @alejandramatus @mirnaschindler @Senado_Chile @Camara_cl @carmen_hertz @_belenaza https://t.co/Nooyy7NSNw,1384746725135503361,und,2021-04-21T05:52:01.000Z,0,0,1,1,#RECHACHAZO...,"",2020-10-21T19:36:20.000Z,#Rechazo...A la derecha de la UDI...Hooyah.👍🦅🇨🇱🇨🇱🇨🇱🇨🇱🇨🇱🇨🇱🇨🇱...#PajaroComunistaMeBotasteDeNuevo,FALSE,kommander911
1375580252987068419,@la_convergencia @gonzalowinter @gabrielboric @GaelDiputada @Alo__arellano @ConySchon @mgoyenechea @pgselles @Naty_campusano @IgnacioAchurra Pónganse de acuerdo... Acabo de leer en otros perfiles y dice que es. Alas 21:00 hrs.,1384676291232817157,es,2021-04-21T01:12:08.000Z,0,0,0,0,Tomás Heisenberg,"",2021-03-26T22:48:01.000Z,"",FALSE,HeisenbergTomas
1479822703,"@Alo__arellano @la_convergencia @elfrente_amplio Cambien la ley entonces, pero no a quien la respeta...",1384686856613343235,es,2021-04-21T01:54:07.000Z,0,0,0,0,Manu Araneda,"",2013-06-03T14:12:34.000Z,"Con el corazón llenito


#MedExtranjeros #Salud #Política #Economía #Educación #Deporte #Teletón",FALSE,ManuAraneda_com
148534970,"@Alo__arellano @la_convergencia @elfrente_amplio Se llenan la boca con la palabra pueblo CUANDO NINGÚN CSM DE USTEDES ES PUEBLOtodos hijitos de papi,egresados de colegios privados,nunca pasaron necesidades, hablan de lo que no conocen!
DONDE XUXA QUEDÓ EL DISCURSO DE LA NUEVA POLÍTICA? Son de cartón lo nuevos perros del pc.",1384687736028901378,es,2021-04-21T01:57:37.000Z,0,0,0,0,Juan Andrés Muñoz,https://t.co/SiRph8yxYo,2010-05-26T23:34:27.000Z,"técnico en Adm. de empresas-aprendiendo dia a día, seguidor del pensamiento libertario menos estado más libertad individual, más familia",FALSE,elfruty
157888221,"@edovillalobosf @NoMasTagChile @Venusiana__ @PedroAbarcaPRO @PiensaPrensa @ChalecosAmarill @FpvrPrensa @Chile_Alerta @chileconvoca @RadioTVLiberaci @primeralineare1 @PPD_Chile @PDC_Chile @PRadicalcl @elfrente_amplio @PCdeChile @ecologistachile @IgualdadPartido @losPROgresistas @FedRegionalista @ComunesCL @Liberales_Chile @la_convergencia @phumanista Por si no lo sabían, los apellidos de la política tienen los escaños asegurados desde el 1810.

https://t.co/lCD81gioCl

Ayuden a pasar la info.",1384699175300911112,es,2021-04-21T02:43:04.000Z,3,0,3,0,gtbach,"",2010-06-21T04:52:19.000Z,Quiero amarte cómo me amas. Gracias madre tierra! 🤗,FALSE,gtbach
1631326796,"@la_convergencia Estoy cansada De este Desgobierno 
sin Trabajo, sin Dinero
Debemos salir a Marchar y Exigir Nuestro Dinero de la AFP #tercerretiroMV 
#marchaPorTercerRetiro
@ArayaPedro @KarlaEnAccion @Senado_Chile @Camara_cl @PamJiles @24HorasTVN @mariseka @CNNChile @Cooperativa",1384702575711301632,es,2021-04-21T02:56:35.000Z,0,0,1,1,#claudina@echeverria,"",2013-07-29T21:44:13.000Z,"",FALSE,claudinaechever
1734099972,@la_convergencia Naaa quemar todo XD,1384663483921358849,es,2021-04-21T00:21:15.000Z,0,0,0,0,lourdes,"",2013-09-06T05:43:41.000Z,"#YoApruebo #NoMásAfp #matelovers
EL FUTURO ES VERDE 🌱! Hasta que la dignidad se haga costumbre !  ♻🌳🌿💚",FALSE,lou_084
175975974,@la_convergencia @gonzalowinter @gabrielboric @GaelDiputada @Alo__arellano @ConySchon @mgoyenechea @pgselles @Naty_campusano @IgnacioAchurra La idiotiza hecha Convergencia ANTISOCIAL.....,1384665610030915587,es,2021-04-21T00:29:41.000Z,0,0,0,0,Jc💚,"",2010-08-08T05:09:49.000Z,"Gracias mi dios por mi alma inconquistable, orden y estructura, Cocinero de Alma, AMO a 🇨🇱 🇪🇸 mi familia y a mi Clara, mi querida GATA.",FALSE,jimicejudo
1856002080,"@la_convergencia @gonzalowinter @gabrielboric @GaelDiputada @Alo__arellano @ConySchon @mgoyenechea @pgselles @Naty_campusano @IgnacioAchurra El fraude amplio y el PC buscan derrocar al gobierno, en su intento número 2876594 en pandemia con un golpe blando para llegar al poder x la fuerza, ya que saben que de manera democrática jamás llegaran al poder, chile los desprecia! #ElPeorCongresoDeLaHistoria #EstallidoDeRatas",1384702267312558084,es,2021-04-21T02:55:21.000Z,1,1,0,0,SoylaOtra 😎,"",2013-09-12T02:21:30.000Z,"Ocupo este espacio como catarsis, nada más, no me interesa tu opinión o que no te guste la mía 💜 siga de largo gracias.",FALSE,NatitoOdiosa
214969744,"@la_convergencia @eldesconcierto @thecliniccl @thetimesCL @biobio @Cooperativa @adnradiochile @uchileradio @radiousach @CNNChile *Cacerolazo nacional contra Piñera!!*

El gobierno quiere matar de hambre al país enviando al TC el retiro del 10%, siendo que son recursos de todas y todos los chilenos!!

20:30 hrs. CACEROLAZO EN TODO CHILE contra Piñera y su gobierno miserable",1384655604921348096,es,2021-04-20T23:49:56.000Z,0,0,2,0,Daniela Cruz,"",2010-11-12T17:42:09.000Z,TODO lo que manifiesto acá es a título personal! ✊🏻👊🏻   #YoVotoElDomingo,FALSE,Flores_Rotas
2329092895,"@la_convergencia @gonzalowinter @gabrielboric @GaelDiputada @Alo__arellano @ConySchon @mgoyenechea @pgselles @Naty_campusano @IgnacioAchurra Con más fuerza!!!!! Todes sus diputades debiesen estar compartiendo esto. Que no quede en un tweet, que sea HISTORIA",1384653875337211904,es,2021-04-20T23:43:04.000Z,0,0,4,0,Faell Rodríguez G.,https://t.co/OAYipaoauh,2014-02-05T17:09:47.000Z,Identidad no-binaria. President- del Centro de Estudiantes de Filosofía UC. Hacia el post-capitalismo.,FALSE,faellsolamente
2353285118,@la_convergencia @GaelDiputada @gonzalowinter @gabrielboric @Alo__arellano @ConySchon @mgoyenechea @pgselles @Naty_campusano @IgnacioAchurra Yapo a que hora estoy q me corto con la regalona del estallido https://t.co/OM142Jtg0O,1384656736028610565,es,2021-04-20T23:54:26.000Z,0,0,1,0,Rolexsoto,"",2014-02-20T14:00:58.000Z,colocolino  tres hijos   420 la lleva .,FALSE,rolexsoto1
2360030347,@la_convergencia https://t.co/z3D2EZSVkQ,1384667170983055360,und,2021-04-21T00:35:54.000Z,0,0,0,0,Pr. Javier Soto  Cta. Oficial,https://t.co/A1AzmeLR0N,2014-02-24T21:00:56.000Z,"Mensaje profético para Chile.
Hagan memoria 1 semana antes del GRAN INCENDIO en Valpo. entregué el mensaje Salmo 104.32 a Bachelet que fue noticia y se cumplió.",FALSE,pastorsotoof
2493221430,"@la_convergencia Irresponsables. ""Las medidas implementadas por el Gobierno Nacional son resistidas de manera criminal... Los pacientes se la pasan dando vueltas horas y hora en ambulancia, antes de ser ubicados en Terapia Intensiva” .. Jefe de Terapia Intensiva del Otamendi",1384658657120595968,es,2021-04-21T00:02:04.000Z,0,0,1,0,Gaucho Cibernético,"",2014-05-13T16:38:50.000Z,Mi nombre es Oscar Richard - Peronista - Contador Público - Especializado en Finanzas y Consultor en temas Organizacionales - Empresario PyMe,FALSE,orejano55
2595837263,@biobio En mi libertad de expresión pienso que @gabrielboric @gonzalowinter y toda @la_convergencia son una cáfila de imbéciles deficientes mentales socavados por el uso de alcohol y drogas. Las bostas son más valiosas que  Uds,1384672868391325697,es,2021-04-21T00:58:32.000Z,0,0,2,0,Rodrigo Calderón Cárdenas,"",2014-06-09T19:47:11.000Z,"Nacionalista, azul hasta la médula. Lucho contra la deconstrucción.
Políticamente incorrecto. Boticario comunitario de verdad y no puro blablá 🎸🎸🎸🎸",FALSE,alabeo88
2865730870,@la_convergencia @Daniel_Dem1 @gonzalowinter @gabrielboric @GaelDiputada @Alo__arellano @ConySchon @mgoyenechea @pgselles @Naty_campusano @IgnacioAchurra pónganse de acuerdo dicen diferentes horas hagan un hashtag,1384653639491493891,es,2021-04-20T23:42:07.000Z,0,1,4,0,metalesrojos valpo,"",2014-11-07T14:37:03.000Z,Escultora,FALSE,met_valpo
3230936278,"La indolencia del Pdte Piñera llevando al Tribunal Constitucional el único salvavidas económico que las familias chilenas, es intolerable y una muestra más de su nula empatia. #TercerRetiro10ciento #Cacelorazo

@gonzalowinter @gabrielboric @la_convergencia @baradit @LatorreJI https://t.co/yAxy1Tddnm",1384674604938141696,es,2021-04-21T01:05:26.000Z,26,1,37,0,Nataly Campusano,https://t.co/RgJ4utjavw,2015-05-03T15:53:19.000Z,"Actual Consejera Regional de Valparaíso por el Frente Amplio. Directora Territorios Colectivos. 
La Región con Lentes de Mujer, vamos con todo! 💜✊",FALSE,Naty_campusano
3315691330,@la_convergencia @Naty_campusano @gonzalowinter @gabrielboric @GaelDiputada @Alo__arellano @ConySchon @mgoyenechea @pgselles @IgnacioAchurra https://t.co/CGBHaseLih,1384655127991263232,und,2021-04-20T23:48:02.000Z,0,0,0,0,Guillermo Quiroz,"",2015-06-09T19:10:18.000Z,En tercera via ciudadana Observó y medito mejorar mi país aunque algunos me vean como un patipelado,FALSE,terceraviaciuda
336293379,"Chile no necesita palabras, necesita acciones. #acusaciónconstitucional
#AcusacionConstitucionalAPiñeraAhora
@RDemocratica @PDC_Chile @PSChile @PRSDChile @Liberales_Chile @la_convergencia @PPD_Chile @PCdeChile @phumanista @elfrente_amplio",1384697134210035712,es,2021-04-21T02:34:57.000Z,1,0,1,0,#apruebo #CC 🏳️‍🌈,"",2011-07-16T01:57:23.000Z,"Chillanense.  Católico. #catlover ... Siempre a la izquierda.
En todo amar y servir 🇨🇱🐈🏳️‍🌈",FALSE,mavileslillo
383309209,"Te acuerdas de este discurso @sebastianpinera, Le estás haciendo lo mismo a tú pueblo, eso si acá con la complicidad de la pseudo IZQUIERDA que no son capaces de acusarte constitucionalmente @PDC_Chile @PSChile @PPD_Chile @PRSDChile @RDemocratica @elfrente_amplio @la_convergencia https://t.co/MO9EsxNVTy",1384742376443416577,es,2021-04-21T05:34:44.000Z,0,0,1,0,Yo APRUEBO Justo Sánchez,"",2011-10-01T17:02:45.000Z,"Dirigente Asociación Nacional de Funcionarios de Aduanas 
Andino de corazón, mi corazón ❤ siempre a la izquierda.",FALSE,jufesa1967
383309209,"@PSChile @PCdeChile
@RDemocratica @elfrente_amplio @la_convergencia",1384735641125195779,und,2021-04-21T05:07:58.000Z,0,0,0,0,Yo APRUEBO Justo Sánchez,"",2011-10-01T17:02:45.000Z,"Dirigente Asociación Nacional de Funcionarios de Aduanas 
Andino de corazón, mi corazón ❤ siempre a la izquierda.",FALSE,jufesa1967
383309209,Ni por ningún candidato perteneciente o patrocinado por la @udipopular @RNchile @evopoli @PLRchile @PPD_Chile @PRSDChile @RDemocratica @elfrente_amplio @la_convergencia,1384721245049180160,es,2021-04-21T04:10:46.000Z,0,0,0,0,Yo APRUEBO Justo Sánchez,"",2011-10-01T17:02:45.000Z,"Dirigente Asociación Nacional de Funcionarios de Aduanas 
Andino de corazón, mi corazón ❤ siempre a la izquierda.",FALSE,jufesa1967
52541795,@grumpy_boris @la_convergencia @gonzalowinter @gabrielboric @GaelDiputada @Alo__arellano @ConySchon @mgoyenechea @pgselles @Naty_campusano @IgnacioAchurra Yo igual es a las 21,1384657720817692674,es,2021-04-20T23:58:20.000Z,0,0,1,0,César.Moya,"",2009-06-30T22:23:00.000Z,"Comunicador y Relacionador Público, agradecido de la vida y siempre tengo ganas de irme de vacaciones 😎 en Insta @chesarestore @eljardindelanana",FALSE,Cesarcmoya
52626317,@chickacko_kakan @Vielinuz Escuchan? #AcusaciónConstitucionalAPiñera. @PPD_Chile  @PDC_Chile   @PRadicalcl @elfrente_amplio @PCdeChile @ecologistachile @IgualdadPartido @losPROgresistas @FedRegionalista @ComunesCL @Liberales_Chile @la_convergencia @phumanista https://t.co/1TNX1kslZr,1384708442041069570,es,2021-04-21T03:19:53.000Z,1,0,2,0,Eduardo Villalobos #NuevaConstitucion,"",2009-07-01T03:58:23.000Z,Somos arquitectos de nuestro  propio destino,FALSE,edovillalobosf
52626317,@karenglavic @ElinaOliva Escuchan? #AcusaciónConstitucionalAPiñera. @PPD_Chile  @PDC_Chile   @PRadicalcl @elfrente_amplio @PCdeChile @ecologistachile @IgualdadPartido @losPROgresistas @FedRegionalista @ComunesCL @Liberales_Chile @la_convergencia @phumanista https://t.co/1TNX1kslZr,1384708339716837377,es,2021-04-21T03:19:29.000Z,0,0,0,0,Eduardo Villalobos #NuevaConstitucion,"",2009-07-01T03:58:23.000Z,Somos arquitectos de nuestro  propio destino,FALSE,edovillalobosf
52626317,@Hmolinamilman @ElinaOliva Escuchan? #AcusaciónConstitucionalAPiñera. @PPD_Chile  @PDC_Chile   @PRadicalcl @elfrente_amplio @PCdeChile @ecologistachile @IgualdadPartido @losPROgresistas @FedRegionalista @ComunesCL @Liberales_Chile @la_convergencia @phumanista https://t.co/1TNX1kslZr,1384708152000712704,es,2021-04-21T03:18:44.000Z,0,0,0,0,Eduardo Villalobos #NuevaConstitucion,"",2009-07-01T03:58:23.000Z,Somos arquitectos de nuestro  propio destino,FALSE,edovillalobosf
52626317,@pparcos1 @ElinaOliva Escuchan? #AcusaciónConstitucionalAPiñera. @PPD_Chile  @PDC_Chile   @PRadicalcl @elfrente_amplio @PCdeChile @ecologistachile @IgualdadPartido @losPROgresistas @FedRegionalista @ComunesCL @Liberales_Chile @la_convergencia @phumanista https://t.co/1TNX1kslZr,1384708102268796928,es,2021-04-21T03:18:32.000Z,0,0,0,0,Eduardo Villalobos #NuevaConstitucion,"",2009-07-01T03:58:23.000Z,Somos arquitectos de nuestro  propio destino,FALSE,edovillalobosf
52626317,@SilvioUgalde @ElinaOliva Escuchan? #AcusaciónConstitucionalAPiñera. @PPD_Chile  @PDC_Chile   @PRadicalcl @elfrente_amplio @PCdeChile @ecologistachile @IgualdadPartido @losPROgresistas @FedRegionalista @ComunesCL @Liberales_Chile @la_convergencia @phumanista https://t.co/yVGgznCAgu,1384695520736817157,es,2021-04-21T02:28:33.000Z,0,0,0,0,Eduardo Villalobos #NuevaConstitucion,"",2009-07-01T03:58:23.000Z,Somos arquitectos de nuestro  propio destino,FALSE,edovillalobosf
52626317,@jprojasporchile Escuchan? #AcusaciónConstitucionalAPiñera. @PPD_Chile  @PDC_Chile   @PRadicalcl @elfrente_amplio @PCdeChile @ecologistachile @IgualdadPartido @losPROgresistas @FedRegionalista @ComunesCL @Liberales_Chile @la_convergencia @phumanista https://t.co/1TNX1kslZr,1384707994148085760,es,2021-04-21T03:18:07.000Z,0,0,2,0,Eduardo Villalobos #NuevaConstitucion,"",2009-07-01T03:58:23.000Z,Somos arquitectos de nuestro  propio destino,FALSE,edovillalobosf
52626317,@GiorgioJackson Escuchan? #AcusaciónConstitucionalAPiñera. @PPD_Chile  @PDC_Chile   @PRadicalcl @elfrente_amplio @PCdeChile @ecologistachile @IgualdadPartido @losPROgresistas @FedRegionalista @ComunesCL @Liberales_Chile @la_convergencia @phumanista https://t.co/1TNX1kslZr,1384707897846898689,es,2021-04-21T03:17:44.000Z,0,0,0,0,Eduardo Villalobos #NuevaConstitucion,"",2009-07-01T03:58:23.000Z,Somos arquitectos de nuestro  propio destino,FALSE,edovillalobosf
52626317,@LobaP_ Escuchan? #AcusaciónConstitucionalAPiñera. @PPD_Chile  @PDC_Chile   @PRadicalcl @elfrente_amplio @PCdeChile @ecologistachile @IgualdadPartido @losPROgresistas @FedRegionalista @ComunesCL @Liberales_Chile @la_convergencia @phumanista https://t.co/1TNX1kslZr,1384707811389722626,es,2021-04-21T03:17:23.000Z,9,1,8,1,Eduardo Villalobos #NuevaConstitucion,"",2009-07-01T03:58:23.000Z,Somos arquitectos de nuestro  propio destino,FALSE,edovillalobosf
52626317,@Enriprimero @ElinaOliva @sebastianpinera Escuchan? #AcusaciónConstitucionalAPiñera. @PPD_Chile  @PDC_Chile   @PRadicalcl @elfrente_amplio @PCdeChile @ecologistachile @IgualdadPartido @losPROgresistas @FedRegionalista @ComunesCL @Liberales_Chile @la_convergencia @phumanista https://t.co/1TNX1kslZr,1384707650500403200,es,2021-04-21T03:16:45.000Z,0,0,0,0,Eduardo Villalobos #NuevaConstitucion,"",2009-07-01T03:58:23.000Z,Somos arquitectos de nuestro  propio destino,FALSE,edovillalobosf
52626317,@Lusaco0 @ElinaOliva Escuchan? #AcusaciónConstitucionalAPiñera. @PPD_Chile  @PDC_Chile   @PRadicalcl @elfrente_amplio @PCdeChile @ecologistachile @IgualdadPartido @losPROgresistas @FedRegionalista @ComunesCL @Liberales_Chile @la_convergencia @phumanista,1384707412670795778,es,2021-04-21T03:15:48.000Z,2,0,1,0,Eduardo Villalobos #NuevaConstitucion,"",2009-07-01T03:58:23.000Z,Somos arquitectos de nuestro  propio destino,FALSE,edovillalobosf
52626317,@christianpviera Escuchan? #AcusaciónConstitucionalAPiñera. @PPD_Chile  @PDC_Chile   @PRadicalcl @elfrente_amplio @PCdeChile @ecologistachile @IgualdadPartido @losPROgresistas @FedRegionalista @ComunesCL @Liberales_Chile @la_convergencia @phumanista https://t.co/XRTHg5YO9n,1384694046552203265,es,2021-04-21T02:22:41.000Z,0,0,0,0,Eduardo Villalobos #NuevaConstitucion,"",2009-07-01T03:58:23.000Z,Somos arquitectos de nuestro  propio destino,FALSE,edovillalobosf
52626317,"@alexis88614364 @mauricio_weibel @bettyflopy @PPD_Chile @PDC_Chile @PRadicalcl @elfrente_amplio @PCdeChile @ecologistachile @IgualdadPartido @losPROgresistas @FedRegionalista @ComunesCL @Liberales_Chile @la_convergencia @phumanista De acuerdo. Pero son los únicos que lo pueden sacar, ya que nosotros no salimos a tomarnos las calles. Nosotros lo tenemos ahí",1384688159016067078,es,2021-04-21T01:59:18.000Z,0,1,0,0,Eduardo Villalobos #NuevaConstitucion,"",2009-07-01T03:58:23.000Z,Somos arquitectos de nuestro  propio destino,FALSE,edovillalobosf
52626317,@_felipecofre Escuchan? #AcusaciónConstitucionalAPiñera. @PPD_Chile  @PDC_Chile   @PRadicalcl @elfrente_amplio @PCdeChile @ecologistachile @IgualdadPartido @losPROgresistas @FedRegionalista @ComunesCL @Liberales_Chile @la_convergencia @phumanista https://t.co/Oz0OzY9EeU,1384687881655042059,es,2021-04-21T01:58:11.000Z,0,0,2,0,Eduardo Villalobos #NuevaConstitucion,"",2009-07-01T03:58:23.000Z,Somos arquitectos de nuestro  propio destino,FALSE,edovillalobosf
52626317,@Francis59320797 @bettyflopy Escuchan? #AcusaciónConstitucionalAPiñera. @PPD_Chile  @PDC_Chile   @PRadicalcl @elfrente_amplio @PCdeChile @ecologistachile @IgualdadPartido @losPROgresistas @FedRegionalista @ComunesCL @Liberales_Chile @la_convergencia @phumanista https://t.co/fUcAyF4dbf,1384685412984279041,es,2021-04-21T01:48:23.000Z,0,0,1,0,Eduardo Villalobos #NuevaConstitucion,"",2009-07-01T03:58:23.000Z,Somos arquitectos de nuestro  propio destino,FALSE,edovillalobosf
52626317,@UWeones @ElinaOliva Escuchan? #AcusaciónConstitucionalAPiñera. @PPD_Chile  @PDC_Chile   @PRadicalcl @elfrente_amplio @PCdeChile @ecologistachile @IgualdadPartido @losPROgresistas @FedRegionalista @ComunesCL @Liberales_Chile @la_convergencia @phumanista https://t.co/pYQ9Z33oyp,1384687711697608705,es,2021-04-21T01:57:31.000Z,0,0,0,0,Eduardo Villalobos #NuevaConstitucion,"",2009-07-01T03:58:23.000Z,Somos arquitectos de nuestro  propio destino,FALSE,edovillalobosf
52626317,@UATVNoticias @BlancaEwert1 Escuchan? #AcusaciónConstitucionalAPiñera. @PPD_Chile  @PDC_Chile   @PRadicalcl @elfrente_amplio @PCdeChile @ecologistachile @IgualdadPartido @losPROgresistas @FedRegionalista @ComunesCL @Liberales_Chile @la_convergencia @phumanista https://t.co/1TNX1kslZr,1384695953018474498,es,2021-04-21T02:30:16.000Z,0,0,0,0,Eduardo Villalobos #NuevaConstitucion,"",2009-07-01T03:58:23.000Z,Somos arquitectos de nuestro  propio destino,FALSE,edovillalobosf
52626317,@alberto2017cruz @ElinaOliva Escuchan? #AcusaciónConstitucionalAPiñera. @PPD_Chile  @PDC_Chile   @PRadicalcl @elfrente_amplio @PCdeChile @ecologistachile @IgualdadPartido @losPROgresistas @FedRegionalista @ComunesCL @Liberales_Chile @la_convergencia @phumanista https://t.co/Pu7e75TJk2,1384695786060013570,es,2021-04-21T02:29:36.000Z,0,0,0,0,Eduardo Villalobos #NuevaConstitucion,"",2009-07-01T03:58:23.000Z,Somos arquitectos de nuestro  propio destino,FALSE,edovillalobosf
52626317,@PiensaPrensa @bettyflopy @sebastianpinera @hernan_sr Escuchan? #AcusaciónConstitucionalAPiñera. @PPD_Chile  @PDC_Chile   @PRadicalcl @elfrente_amplio @PCdeChile @ecologistachile @IgualdadPartido @losPROgresistas @FedRegionalista @ComunesCL @Liberales_Chile @la_convergencia @phumanista https://t.co/uqYYXvDXmW,1384686904549986307,es,2021-04-21T01:54:18.000Z,1,0,1,0,Eduardo Villalobos #NuevaConstitucion,"",2009-07-01T03:58:23.000Z,Somos arquitectos de nuestro  propio destino,FALSE,edovillalobosf
