author_id,created_at.x,id,text,lang,public_metrics.retweet_count,public_metrics.reply_count,public_metrics.like_count,public_metrics.quote_count,url,username,description,verified,name,created_at.y
105816111,2021-04-21T00:49:09.000Z,1384670508084604930,"@Minvu @FelipeWard @GuilleRolandoV @GobiernodeChile Buenas noches. Si tuve disminución en mis ingresos en el periodo 2020 y no pude participar en el 1ero proceso, puedo participar en este 2gdo proceso de subsidio? Gracias",es,0,0,0,0,"",VeroVillasmilG,"",FALSE,Verónica González ♥,2010-01-17T15:44:18.000Z
105816111,2021-04-21T00:51:01.000Z,1384670976483500032,@Minvu @FelipeWard @GuilleRolandoV @GobiernodeChile Buenas. Si tuve disminución en mis ingresos en el periodo 2020 y no pude participar en el llamado del periodo 2020. ¿Puedo participar en este llamado del 2021?,es,0,0,0,0,"",VeroVillasmilG,"",FALSE,Verónica González ♥,2010-01-17T15:44:18.000Z
1167246358883028998,2021-04-20T21:56:08.000Z,1384626967908130817,@minvu_loslagos @JorgeAGuevara6 @geisse_carlos @Minvu @FelipeWard @ServiuLosLagos @Int_LosLagos @VoceriaLosLagos @GoreLagos @F_Binder82 cuando estará listooo!???,es,0,0,0,0,"",__benja_a,🇨🇱| 𝚒𝚐: ___𝚋𝚎𝚗𝚓𝚊.𝚊⠀⠀⠀⠀⠀⠀⠀⠀,FALSE,Бепᴊд 🇨🇱,2019-08-30T01:23:24.000Z
1223276855324790785,2021-04-21T03:06:45.000Z,1384705135704780800,"@Minvu @FelipeWard @GuilleRolandoV @GobiernodeChile No , tengo fondos...",es,0,0,0,0,"",Plutoni46546589,La vida es bella.,FALSE,Plutonio,2020-01-31T16:09:12.000Z
1226240945282306048,2021-04-21T04:58:58.000Z,1384733377274728448,@vlcorreau @felipekast @ipoduje @quilpueciudad @FelipeWard @Minvu @IntendenciaV @andreslongton Y s cuantos mapuches han matado para quitarle sus territorios???,es,0,0,0,0,https://t.co/JRmzJ8EdHy,Albertok691,"Un tipo cualquiera....
Deje un poco de hablar de política por sanidad mental aunque si hay que quemar todo allá vamos. 

Sin futuro no hay nada que perder.",FALSE,Albertok,2020-02-08T20:26:53.000Z
1243252031105773569,2021-04-21T04:01:54.000Z,1384719015709487109,"@FelipeWard @Minvu @GuilleRolandoV @minvuvalparaiso @MinvuOHiggins @MinvuRM @minvu_loslagos @minvubiobio @MinvuAntofa @minvuatacama @minvumagallanes Y yo esperando años, dentro del 40% postulo al subsidio arriendo adulto mayor y no me lo dan, cómo se puede postular a este beneficio plan 10000 👏👏🙌?",es,0,0,0,0,"",Bolsasdetelas,"Hola, somos un pequeño emprendimiento familiar, fabricamos bolsas de tela en casa, diferentes diseños, multiuso y especial para el pan, tamaños 40 x 40 cms.",FALSE,Bolsasdetelas,2020-03-26T19:05:21.000Z
1243252031105773569,2021-04-21T03:57:59.000Z,1384718029498486784,"@Minvu @paulina28806253 @FelipeWard @GuilleRolandoV @GobiernodeChile Yo estoy dentro del 40% postulé 2 veces al subsidio adulto mayor y no me lo dan, por qué? #minvu",es,0,0,0,0,"",Bolsasdetelas,"Hola, somos un pequeño emprendimiento familiar, fabricamos bolsas de tela en casa, diferentes diseños, multiuso y especial para el pan, tamaños 40 x 40 cms.",FALSE,Bolsasdetelas,2020-03-26T19:05:21.000Z
1266072324618387457,2021-04-20T22:36:43.000Z,1384637177519382529,@Minvu @FelipeWard @GuilleRolandoV @GobiernodeChile Alguien sabe cuanto es el ahorro mínimo?? 🤔,es,0,0,0,0,"",Quenniiz,"Madre 👩‍👦‍👦, imperfecta....... Sii, doglover, catlover 🍃🍀🍃, love of my life 🎶💜💙💚",FALSE,pío pío pipau 🙋‍♀️💜🍃🌹🍃,2020-05-28T18:22:57.000Z
1268606275014795266,2021-04-21T01:31:13.000Z,1384681094163927043,"@FelipeWard @Minvu @GuilleRolandoV @minvuvalparaiso @MinvuOHiggins @MinvuRM @minvu_loslagos @minvubiobio @MinvuAntofa @minvuatacama @minvumagallanes ministro y cual será la forma de reasignación de esas viviendas ?, ya que hay muchas familias con subsidio adjudicado. seria maravilloso, que estas se entreguen de la manera mas transparente a familias que de verdad lo necesitan y que se hubieran sacrificado por un subsidio.",es,0,0,1,0,"",barbara58658368,"",FALSE,Barbara Bustos Molina,2020-06-04T18:13:01.000Z
1276812511300419586,2021-04-20T20:25:15.000Z,1384604092635312128,"@FelipeWard @Minvu @GuilleRolandoV @minvuvalparaiso @MinvuOHiggins @MinvuRM @minvu_loslagos @minvubiobio @MinvuAntofa @minvuatacama @minvumagallanes Tengo una vivienda propia, pero está en malas condiciones habitacionales en dos ocasiones he solicitado en certificado en el municipio pero solo me dicen que no califico, pero mi casa tiene problemas de termitas, filtraciones de agua en el techo,mala electricidad etc.ayuda minist",es,0,0,0,0,"",Jenavas3,linda,FALSE,Jenavas,2020-06-27T09:40:17.000Z
1276812511300419586,2021-04-20T20:29:12.000Z,1384605090632376321,"@FelipeWard Don Felipe, no puedo obtener mi certificado de inhabitabilidad de mi casa ,tengo mala las paredes, la electricidad el techo de los dormitorios el piso y hay termitas dos veces e pedido el papel en la Muni pero no califico .quiero postular al sub de construc de viviend",es,0,0,1,0,"",Jenavas3,linda,FALSE,Jenavas,2020-06-27T09:40:17.000Z
1276977254015303686,2021-04-21T04:25:26.000Z,1384724935629840385,@Minvu @FelipeWard @GuilleRolandoV @GobiernodeChile Holaa buenas noches si me pueden responder al subsidio DS1 subsidio en sitio propio cuando empieza postulación ya es tercera vez que se postula y siempre hay un pero https://t.co/0OIChkxJzA anterior ..,es,0,0,0,0,"",Mary22557454,"",FALSE,Mary,2020-06-27T20:34:54.000Z
1276977254015303686,2021-04-21T04:19:54.000Z,1384723542235926530,@Minvu @FelipeWard @GuilleRolandoV @GobiernodeChile Ministro consulta el subsidio  DS1para  construir en sitio propio cuando viene la postulación .si me puede ayudar con esa respuesta .por favor,es,0,0,0,0,"",Mary22557454,"",FALSE,Mary,2020-06-27T20:34:54.000Z
1288849519552200708,2021-04-20T19:30:28.000Z,1384590307623424006,"@Minvu @FelipeWard @GuilleRolandoV @GobiernodeChile Estoy sin ingresos desde octubre 2020 según registro social no califico , postule hace 1,5 meses al subsidio verificaron datos del arrendador y no tuve más respuestas, que más debo hacer?",es,0,1,0,0,"",erikapcschulz,"",FALSE,erika,2020-07-30T14:50:56.000Z
1291134028377137152,2021-04-20T23:13:37.000Z,1384646466506010624,@Minvu @FelipeWard @GuilleRolandoV @GobiernodeChile Hola! Es obligatorio tener 1 año  con los ahorros en esa cuenta? O lo importante es que este depositado el dinero en la cuenta.,es,0,0,0,0,"",LugaresdeV,"Administrador de empresas con menciones en Ventas, Gerencia y Mercadeo. Gire a la Derecha↪️",FALSE,Maro,2020-08-05T22:08:44.000Z
1302618571751784448,2021-04-20T20:53:02.000Z,1384611085286879233,"@Minvu @FelipeWard @GuilleRolandoV @GobiernodeChile @Minvu los certificados del ds1 ganados en febrero región metropolitana, cuando lo entregan, el banco lo pide",es,0,2,0,0,"",ChrisRodri7,Viajero del mundo,FALSE,Chris Rodri,2020-09-06T14:44:32.000Z
1325443152040308736,2021-04-21T00:47:55.000Z,1384670195390861313,@FelipeWard @Minvu @GuilleRolandoV @minvuvalparaiso @MinvuOHiggins @MinvuRM @minvu_loslagos @minvubiobio @MinvuAntofa @minvuatacama @minvumagallanes Déjense de escribir huevadas lacras ladrones,es,0,0,0,0,"",DanielC66739580,la felicidad,FALSE,Daniel Catalan,2020-11-08T14:21:13.000Z
1326170701070479360,2021-04-20T20:15:57.000Z,1384601753711267849,@Minvu @FelipeWard @GuilleRolandoV @GobiernodeChile https://t.co/n6b1hIeoJ5 buenas tardes yo soy del 40% más bulnerable puedo postular si tengo los ahorros yo vivo en una media agua con mis dos hijo de 4 y 10 años y ya empezó el mal tiempo no tengo ni baño ni agua dentro tengo que salir para ir alas cosas básicas,es,0,1,0,0,"",paulina28806253,jamás perder la esperanza,FALSE,paulina sanhueza,2020-11-10T14:32:16.000Z
1331211867033919496,2021-04-20T21:02:23.000Z,1384613440522637314,@Minvu @FelipeWard @GuilleRolandoV @GobiernodeChile Hola Minvu cuándo las postulaciones de arriendo regular,es,0,0,0,0,"",DevoraQuintani3,soy soñadora,FALSE,Devora Quintanilla,2020-11-24T12:23:47.000Z
1342912998378188803,2021-04-21T01:16:51.000Z,1384677480162856961,@FelipeWard @Minvu @GuilleRolandoV @minvuvalparaiso @MinvuOHiggins @MinvuRM @minvu_loslagos @minvubiobio @MinvuAntofa @minvuatacama @minvumagallanes Y porque no leda la posibilidad a la gente que se ganó el subsidio  con eso,es,0,0,0,0,"",YMonjes12,doy mi vida por  mis hijos 😘😘,FALSE,Yanira.monjes12@gmail.com,2020-12-26T19:19:55.000Z
1348382577808322562,2021-04-21T03:10:05.000Z,1384705975437955074,"@Minvu @FelipeWard @GuilleRolandoV @GobiernodeChile Hola cómo puedo postular soy soltera y cuento con un ahorro de 600 Lucas, y estoy en el 50 por ciento de vulnerabilidad",es,0,0,0,0,"",orfarate,La vida feliz,FALSE,prisma,2021-01-10T21:34:15.000Z
1351259395687116801,2021-04-20T20:03:17.000Z,1384598564525969408,@erikapcschulz @Minvu @FelipeWard @GuilleRolandoV @GobiernodeChile De cuánto es el ahorro mínimo que hay que tener...yo pertenezco al 40 puedo postular igual,es,0,1,0,0,"",JessicaIsla9,"",FALSE,Jessica Isla,2021-01-18T20:05:30.000Z
1363863817868951553,2021-04-20T22:59:35.000Z,1384642933190713345,@amorenocharme @FelipeWard @GobiernodeChile @sebastianpinera @mop_chile @GloriaHutt @Minvu @MTTChile @MinagriCL Teni el $ marcado en el culo. Ctm,es,0,0,0,0,https://t.co/kqAmx8FwyV,CarabineroC,los pacos son put@s del 3stado,FALSE,Carabinero corrupto,2021-02-22T14:50:57.000Z
1364022565694537734,2021-04-21T02:24:54.000Z,1384694602188435458,"@FelipeWard @ElMercurio_cl @Minvu @GobiernodeChile @GuilleRolandoV Yo no sé para que dan TANTOS subsidio, si no lo podemos ocupar, todos los años se suman más personas sin poder ocupar sus subsidios DS1T1, es como ya le damos sus subsidios para que no hinchen más. Pero a la vez quedamos en NADA.
@FelipeWard @mas_integracion @Minvu",es,0,0,0,0,"",MunozFernandaP,"",FALSE,Fernanda muñoz,2021-02-23T01:21:59.000Z
1364022565694537734,2021-04-21T01:48:47.000Z,1384685516172505091,"@FelipeWard @ElMercurio_cl @Minvu @GobiernodeChile @GuilleRolandoV Somos más de 74 FAMILIAS que no podemos ocupar el subsidio porque acá en la región metropolitana, NO HAY NADA con 1.200 UF y las inmobiliarias a toda costa nos quieren meter con 1.400 UF pero nos bajan las UF a 450 y más encima con crédito hipotecario
@mas_integracion @FelipeWard",es,3,1,3,0,"",MunozFernandaP,"",FALSE,Fernanda muñoz,2021-02-23T01:21:59.000Z
1369820981653540872,2021-04-20T21:34:19.000Z,1384621474003275778,"@FelipeWard @Minvu @GuilleRolandoV @serviuohiggins @ServiuAraucania @ServiuRM @Serviuvalpo @serviubiobio @ServiuMaule @serviuantofagas @ServiuCoquimbo Para que mas subsidios si no solucionan lo que estamos esperando casi dos años o más, subsidio ds1t1 una burla, subsidio fantasma.. #masintegracionsocial queremos una solución ministro y no nos mate la ilusión de tener nuestra casa propia 😔",es,0,0,1,0,"",RosalynnClara,"",FALSE,Rosalynn Clara,2021-03-11T01:22:45.000Z
1369825882798501891,2021-04-21T03:04:27.000Z,1384704555955499013,"@mas_integracion @FelipeWard @sebastianpinera Claramente ellos no deben salir a trabajar, no pasan necesidades puesto que tienen su hogar. No pedimos nada gratis, luchamos años para tener ganarnos el ds1t1 y ud sabe de nuestra problemática, no se tape los ojos que esa no es su misión. Entregue soluciones concretas",es,1,0,0,0,"",Sandy92444087,"Aperrando con mi pequeña guerrera 
Mamá ama a hija",FALSE,Sandy,2021-03-11T01:42:09.000Z
1369825882798501891,2021-04-20T21:54:37.000Z,1384626583370088449,@FelipeWard @Minvu @GuilleRolandoV @serviuohiggins @ServiuAraucania @ServiuRM @Serviuvalpo @serviubiobio @ServiuMaule @serviuantofagas @ServiuCoquimbo @Hinata37551480,und,0,0,0,0,"",Sandy92444087,"Aperrando con mi pequeña guerrera 
Mamá ama a hija",FALSE,Sandy,2021-03-11T01:42:09.000Z
1369825882798501891,2021-04-20T21:09:03.000Z,1384615117220896770,@Minvu @FelipeWard @GuilleRolandoV @GobiernodeChile Soluciones reales a problemáticas reales. El grupo #unidaspormascuposdeintegracion las necesitamos,es,0,0,0,0,"",Sandy92444087,"Aperrando con mi pequeña guerrera 
Mamá ama a hija",FALSE,Sandy,2021-03-11T01:42:09.000Z
1370169437698060288,2021-04-20T20:53:21.000Z,1384611166043967488,@FelipeWard https://t.co/gTxDmMFzTj,und,0,0,0,1,"",MarioVe85398378,"",FALSE,Mario Vera,2021-03-12T00:27:25.000Z
1370169437698060288,2021-04-20T20:52:18.000Z,1384610902490636291,"@FelipeWard por años las AFP han financiado y engordado a grandes grupos inmobiliarios para ke construyan edificios condominios y casas ABC1,con los ahorros de los trabajadores ke tienen que tomarse terrenos para tener un techo por lo caro del arriendo",es,0,0,0,0,"",MarioVe85398378,"",FALSE,Mario Vera,2021-03-12T00:27:25.000Z
1370528145649102852,2021-04-20T20:51:23.000Z,1384610669455187969,"@Minvu @FelipeWard @GuilleRolandoV @GobiernodeChile Hola, me podría dar el link de los requisitos? Gracias",es,0,1,0,0,https://t.co/jEAr98tsdh,lilliganto1,"",FALSE,JVR,2021-03-13T00:16:21.000Z
1371497612386439173,2021-04-20T21:30:55.000Z,1384620618436521996,@Minvu @FelipeWard @GuilleRolandoV @GobiernodeChile Siguen dando sub y ahun ahí mucha gente que no tiene solución con sub ganado y con los brazos cruzados,es,0,0,0,0,"",AnaGabr25998486,ser yo,FALSE,Ana Gabriel,2021-03-15T16:24:54.000Z
1373348188992704515,2021-04-21T02:00:41.000Z,1384688509034942469,"@Dayana72670481 @FelipeWard @ServiuRM @Minvu @GuilleRolandoV @minvuvalparaiso @MinvuOHiggins @MinvuRM @minvu_loslagos @minvubiobio @MinvuAntofa @minvuatacama @minvumagallanes si que se liberen, es una de las formas que tienen para poder bajar el déficit que hay de cupos de integración social en la R.M, es una de las soluciones mas rapidas que tienen. Lo otro antes de seguir dando subsidios solucionen toda la gente que lleva años sin poder usarlo.",es,1,0,0,0,"",mas_integracion,"somos un grupo de familias con subsidio ds1 tramo 1, que buscamos más cupos de integración social, luchamos por el sueño de la casa propia.",FALSE,Unidas Por Más Cupos De Integración Social,2021-03-20T18:58:47.000Z
1373348188992704515,2021-04-21T01:42:18.000Z,1384683881559990273,"las familias de chile están  viviendo de allegados en hacinamiento, no tenemos para seguir pagando arriendo, por algo fueron muchos los años de sacrificio para poder adjudicarnos un subsidio, y de que sirvió ?, tendremos que irnos a una toma ? @FelipeWard @sebastianpinera",es,1,0,4,0,"",mas_integracion,"somos un grupo de familias con subsidio ds1 tramo 1, que buscamos más cupos de integración social, luchamos por el sueño de la casa propia.",FALSE,Unidas Por Más Cupos De Integración Social,2021-03-20T18:58:47.000Z
1373348188992704515,2021-04-20T22:18:46.000Z,1384632660602011650,"no necesitamos prorrogas en nuestro subsidio, necesitamos soluciones. Que podamos ocupar nuestros subsidios pronto, no en 7 años mas, somos familias que aunque no vivimos en tomas, tenemos vulnerabilidad, tambien necesitamos prioridad. @Minvu @FelipeWard @GuilleRolandoV",es,5,0,6,0,"",mas_integracion,"somos un grupo de familias con subsidio ds1 tramo 1, que buscamos más cupos de integración social, luchamos por el sueño de la casa propia.",FALSE,Unidas Por Más Cupos De Integración Social,2021-03-20T18:58:47.000Z
1373348188992704515,2021-04-20T21:07:24.000Z,1384614700743286785,"@FelipeWard @Minvu @GuilleRolandoV @minvuvalparaiso @MinvuOHiggins @MinvuRM @minvu_loslagos @minvubiobio @MinvuAntofa @minvuatacama @minvumagallanes Este mal uso de viviendas sociales es culpa directamente del serviu y su deficiente fiscalización en todos los sentidos, no es solo este punto el que siempre contrevercia, son muchos, creo que han trabajado pero aún falta mucho que solucionar. Y por eso seguiremos luchando",es,1,1,3,0,"",mas_integracion,"somos un grupo de familias con subsidio ds1 tramo 1, que buscamos más cupos de integración social, luchamos por el sueño de la casa propia.",FALSE,Unidas Por Más Cupos De Integración Social,2021-03-20T18:58:47.000Z
1373348188992704515,2021-04-21T01:38:35.000Z,1384682946662182912,"@minvu @FelipeWard @GuilleRolandoV @ServiuRM @sebastianpinera seguimos luchando por soluciones para muchas familias con subsidio ds1t1t1, por que aun no tenemos soluciones concretas, no nos sirve que nos digan que el subsidio no se nos vencerá en 5 años, queremos un hogar.",es,0,1,2,0,"",mas_integracion,"somos un grupo de familias con subsidio ds1 tramo 1, que buscamos más cupos de integración social, luchamos por el sueño de la casa propia.",FALSE,Unidas Por Más Cupos De Integración Social,2021-03-20T18:58:47.000Z
1373348188992704515,2021-04-21T01:49:22.000Z,1384685662381748225,"las comunas que han bajado los casos de covid, son comunas del sector oriente, familias que pueden hacer cuarentena, en sus grandes casas, pero los demás vivimos en hacinamiento por lo que tenemos contagio intradomiciliario, necesitamos nuestras casas @FelipeWard @sebastianpinera",es,2,2,3,0,"",mas_integracion,"somos un grupo de familias con subsidio ds1 tramo 1, que buscamos más cupos de integración social, luchamos por el sueño de la casa propia.",FALSE,Unidas Por Más Cupos De Integración Social,2021-03-20T18:58:47.000Z
1373348188992704515,2021-04-20T21:01:36.000Z,1384613240462774274,"@FelipeWard @Minvu @GuilleRolandoV @minvuvalparaiso @MinvuOHiggins @MinvuRM @minvu_loslagos @minvubiobio @MinvuAntofa @minvuatacama @minvumagallanes Sería buena saber cómo se hará la reasignación de esas viviendas, ya que ayudaría al gran déficit, de las familias con subsidio ds1t1t1, que aún no encuentran integración social, nos gustaría transparencia en toda la entrega de viviendas sociales, ya que siempre hay trabas.",es,1,0,1,0,"",mas_integracion,"somos un grupo de familias con subsidio ds1 tramo 1, que buscamos más cupos de integración social, luchamos por el sueño de la casa propia.",FALSE,Unidas Por Más Cupos De Integración Social,2021-03-20T18:58:47.000Z
1373348188992704515,2021-04-21T02:05:59.000Z,1384689844652228609,"@MunozFernandaP @FelipeWard @ElMercurio_cl @Minvu @GobiernodeChile @GuilleRolandoV somos 74 familias de muchas mas que soñaban con la casa propia, juntando peso a peso para poder obtener el subsidio, y ahora aquí estamos a brazos cruzados sin poder ocupar nuestro subsidio, no queremos mas aspirinas, necesitamos prioridad al igual que los campamentos, solucion",es,1,0,1,0,"",mas_integracion,"somos un grupo de familias con subsidio ds1 tramo 1, que buscamos más cupos de integración social, luchamos por el sueño de la casa propia.",FALSE,Unidas Por Más Cupos De Integración Social,2021-03-20T18:58:47.000Z
1373348188992704515,2021-04-21T02:09:46.000Z,1384690796750942210,"@Jeniffe79264647 @FelipeWard @sebastianpinera lamentablemente los políticos viven en una burbuja, donde no son capaces de ver la realidad de las familias chilenas, ellos viven otra realidad. por eso seguiremos luchando, por que nos cansamos de ser invisibles.",es,0,0,0,0,"",mas_integracion,"somos un grupo de familias con subsidio ds1 tramo 1, que buscamos más cupos de integración social, luchamos por el sueño de la casa propia.",FALSE,Unidas Por Más Cupos De Integración Social,2021-03-20T18:58:47.000Z
1374113859817119746,2021-04-20T22:42:00.000Z,1384638509940723712,"@GuilleRolandoV @Minvu Serviu solo me sugiere renunciar al subsidio, después de tanto esfuerzo .. Me parece insólito
Quiero ver opciones en regiónes.. Y me piden el puntaje de corte.
No hay manera de aumentar ese puntaje con más ahorros??? Pará no renunciar al subsidio
@FelipeWard @mas_integracion",es,0,0,0,0,"",Dayana72670481,"Mamá de Alison 💕
Comuna de El bosque, RM",FALSE,Dayana Unda Hernández,2021-03-22T21:40:58.000Z
1374113859817119746,2021-04-20T22:39:23.000Z,1384637852076675086,"@GuilleRolandoV @Minvu Liberen las restricciones del ds1 para comprar en regiónes al igual que el ds49..
La región metropolitana no tiene integración social.. TODOS ESTAMOS EN PANDEMIA @MAS_INTEGRACION @FELIPEWARD
#liberenlasrestriccionesdelsubsidiods1",es,0,0,0,0,"",Dayana72670481,"Mamá de Alison 💕
Comuna de El bosque, RM",FALSE,Dayana Unda Hernández,2021-03-22T21:40:58.000Z
1374113859817119746,2021-04-20T22:32:30.000Z,1384636116255522817,"@ServiuRM @FelipeWard @Minvu Liberen las restricciones del ds1 para comprar en regiónes..
La región metropolitana no tiene integración social!!!!
@felipewarde @MinvuRM
@mas_integracion

#unidosporintegracionsocial
#liberenlasrestriccionesdelsubsidiods1",es,0,0,0,0,"",Dayana72670481,"Mamá de Alison 💕
Comuna de El bosque, RM",FALSE,Dayana Unda Hernández,2021-03-22T21:40:58.000Z
1374113859817119746,2021-04-20T22:29:14.000Z,1384635294222323714,"@Minvu @ServiuRM @FelipeWard @GuilleRolandoV @MinvuRM @GobiernodeChile @mjerrazurizt Queremos mas integración social.. La región metropolitana está copada. Liberen las restricciones del ds1 para comprar en regiónes

#liberenlasrestriccionesdelsubsidiods1
#unidosporintegracionsocial #subsidiofantasma #liberenlasrestriccionesdelsubsidiods1",es,0,0,0,0,"",Dayana72670481,"Mamá de Alison 💕
Comuna de El bosque, RM",FALSE,Dayana Unda Hernández,2021-03-22T21:40:58.000Z
1374113859817119746,2021-04-20T22:37:35.000Z,1384637398378815495,@Minvu @ServiuRM @FelipeWard @GuilleRolandoV @GobiernodeChile LIBEREN LAS RESTRICCIONES DEL DS1 PARA COMPRAR EN REGIÓNES AL IGUAL QUE EL SUBSIDIO DS49.. TODOS ESTAMOS EN PANDEMIA @MAS_INTEGRACION @FELIPEWARD,es,0,0,0,0,"",Dayana72670481,"Mamá de Alison 💕
Comuna de El bosque, RM",FALSE,Dayana Unda Hernández,2021-03-22T21:40:58.000Z
1374113859817119746,2021-04-20T22:35:03.000Z,1384636761364705281,"@MinvuRM @patrimonio_cl @MNHNcl LIBEREN LAS RESTRICCIONES DEL DS1 PARA COMPRAR EN REGIÓNES AL IGUAL QUE El SUBSIDIO DS49.. TODOS ESTAMOS EN PANDEMIA. LA RM NO TIENE INTEGRACIÓN SOCIAL

#SUBSIDIOFANTASMA
#DS1TRAMO1MASCUPOS
#LIBERENLASRESTRICCIONESDELSUBSIDIODS1

@FelipeWard @MinvuRM @mas_integracion",es,0,0,0,0,"",Dayana72670481,"Mamá de Alison 💕
Comuna de El bosque, RM",FALSE,Dayana Unda Hernández,2021-03-22T21:40:58.000Z
1374113859817119746,2021-04-20T22:42:46.000Z,1384638702287265794,"@Minvu @GuilleRolandoV @FelipeWard @GobiernodeChile Desesperada nivel dios!
@FelipeWard @MinvuRM @mas_integracion
LIBEREN LAS RESTRICCIONES DEL DS1 PARA COMPRAR EN REGIÓNES AL IGUAL QUE LOS DEL SUBSIDIO DS49",es,0,0,0,0,"",Dayana72670481,"Mamá de Alison 💕
Comuna de El bosque, RM",FALSE,Dayana Unda Hernández,2021-03-22T21:40:58.000Z
1374113859817119746,2021-04-20T22:31:32.000Z,1384635876702048257,"@MinDesarrollo LIBEREN LAS RESTRICCIONES DEL DS1 PARA COMPRAR EN REGIÓNES AL IGUAL QUE LOS DEL SUBSIDIO DS49... TODOS ESTAMOS EN PANDEMIA
@FelipeWard
@MinvuRM #UNIDOSPORINTEGRACIONSOCIAL
#SUBSIDIOFANTASMA
#DS1TRAMO1MASCUPOS
#FISCALIZACIÓNALASINMOBILIARIAS
#LIBERENLASRESTRICCIONESDELSUBSIDIODS1",es,0,0,0,0,"",Dayana72670481,"Mamá de Alison 💕
Comuna de El bosque, RM",FALSE,Dayana Unda Hernández,2021-03-22T21:40:58.000Z
1374113859817119746,2021-04-20T22:30:23.000Z,1384635584237514775,"@meganoticiascl Liberen las restricciones del ds1 para comprar en regiónes al igual que el ds49
@FelipeWard @MinvuRM
@mas_integracion
#unidosporintegracionsocial
#subsidiofantasma
#ds1tramo1mascupos
#Fiscalizaciónalasinmobiliarias
#liberenlasrestriccionesdelsubsidiods1",es,0,0,0,0,"",Dayana72670481,"Mamá de Alison 💕
Comuna de El bosque, RM",FALSE,Dayana Unda Hernández,2021-03-22T21:40:58.000Z
1374113859817119746,2021-04-20T22:36:52.000Z,1384637218308993025,"@FelipeWard @ServiuRM @Minvu @GuilleRolandoV @minvuvalparaiso @MinvuOHiggins @MinvuRM @minvu_loslagos @minvubiobio @MinvuAntofa @minvuatacama @minvumagallanes MINISTRO... LIBEREN LAS RESTRICCIONES DEL DS1 PARA COMPRAR EN REGIÓNES
LA RM NO TIENE INTEGRACIÓN SOCIAL, SOMOS MUCHAS FAMILIAS EN LA MISMA SITUACIÓN
Y SIGUEN DANDO SUBSIDIOS.. PURAS ASPIRINAS!!!! 
#SUBSIDIOFANTASMA
@MAS_INTEGRACION",es,2,1,4,0,"",Dayana72670481,"Mamá de Alison 💕
Comuna de El bosque, RM",FALSE,Dayana Unda Hernández,2021-03-22T21:40:58.000Z
1374113859817119746,2021-04-20T22:43:46.000Z,1384638953085616128,@Minvu @FelipeWard @GuilleRolandoV @GobiernodeChile LIBEREN LAS RESTRICCIONES DEL DS1 PARA COMPRAR EN REGIÓNES AL IGUAL QUE LOS DEL SUBSIDIO DS49.. TODOS ESTAMOS EN PANDEMIA @MAS_INTEGRACION @FELIPEWARD,es,0,0,0,0,"",Dayana72670481,"Mamá de Alison 💕
Comuna de El bosque, RM",FALSE,Dayana Unda Hernández,2021-03-22T21:40:58.000Z
1374160751787700227,2021-04-20T22:55:37.000Z,1384641933944016900,"@Minvu @FelipeWard @GuilleRolandoV @GobiernodeChile Hola,mi hijo quedó sin trabajo en 4/del 2020 vive de allegado el a postulado a 2subsidio vivienda social y rural, yo le cedi unos metros de suelo para poder ayudarle a conseguir su casa tiene su libreta de ahorro hace 3 año pero lamentablemente no a podido calificar para lacasa",es,0,0,0,0,"",Thalacid74,siempre alegre divertida y servicial,FALSE,Italia,2021-03-23T00:47:55.000Z
1374160751787700227,2021-04-20T23:04:31.000Z,1384644177070276609,"@FelipeWard @Minvu @GuilleRolandoV @minvuvalparaiso @MinvuOHiggins @MinvuRM @minvu_loslagos @minvubiobio @MinvuAntofa @minvuatacama @minvumagallanes Lamentablemente este es un país de los vivos, son muchas las personas que obtienen vivienda sin necesidad y dejan a otros que si la necesitan con urgencia acá en Hijuelas paso y sigue pasando ,mis hijos ninguno a calificado, apesar de vivir de allegado o pagando arriendo.",es,0,0,0,0,"",Thalacid74,siempre alegre divertida y servicial,FALSE,Italia,2021-03-23T00:47:55.000Z
1374447181155897350,2021-04-21T02:57:02.000Z,1384702691486617600,"@T13 @FelipeWard @Minvu @ServiuRM
7000 y cuantos realmente podrán aplicarlos? Hay cientos que tenemos el DS1 tramo1 y NO HAY CUPOS DE INTEGRACION en las inmobiliarias. Dar solución a estas familias debería ser su prioridad y NO jugar con la esperanza de miles.
Necesitamos solución hoy",es,0,0,0,0,"",Jeniffe79264647,amo a mi familia 😍😍,FALSE,Jeniffer🤗🤗,2021-03-23T19:45:53.000Z
